{
  "version": "1.1.0",
  "name": "atlas-supply-chain-v0",
  "description": "Supply-chain + air corridor world model with aliases and traffic weights",
  "nodes": [
    {
      "id": "bab-el-mandeb",
      "name": "Bab el-Mandeb",
      "type": "chokepoint",
      "lat": 12.58,
      "lng": 43.33,
      "region": "red-sea",
      "commodities": [
        "crude",
        "lng",
        "container"
      ],
      "aliases": [
        "bab el mandeb",
        "red sea",
        "yemen",
        "aden gulf"
      ]
    },
    {
      "id": "suez",
      "name": "Suez Canal",
      "type": "chokepoint",
      "lat": 30.45,
      "lng": 32.35,
      "region": "red-sea",
      "commodities": [
        "crude",
        "container",
        "grain"
      ],
      "aliases": [
        "suez canal",
        "suez",
        "egypt"
      ]
    },
    {
      "id": "hormuz",
      "name": "Strait of Hormuz",
      "type": "chokepoint",
      "lat": 26.57,
      "lng": 56.25,
      "region": "gulf",
      "commodities": [
        "crude",
        "lng"
      ],
      "aliases": [
        "strait of hormuz",
        "persian gulf",
        "hormuz strait",
        "gulf"
      ]
    },
    {
      "id": "malacca",
      "name": "Strait of Malacca",
      "type": "chokepoint",
      "lat": 2.5,
      "lng": 101.5,
      "region": "se-asia",
      "commodities": [
        "crude",
        "container",
        "lng"
      ],
      "aliases": [
        "malacca",
        "strait of malacca"
      ]
    },
    {
      "id": "gibraltar",
      "name": "Strait of Gibraltar",
      "type": "chokepoint",
      "lat": 35.95,
      "lng": -5.6,
      "region": "med",
      "commodities": [
        "crude",
        "container"
      ],
      "aliases": [
        "gibraltar"
      ]
    },
    {
      "id": "panama",
      "name": "Panama Canal",
      "type": "chokepoint",
      "lat": 9.08,
      "lng": -79.68,
      "region": "americas",
      "commodities": [
        "container",
        "lng",
        "grain"
      ],
      "aliases": [
        "panama canal",
        "panama"
      ]
    },
    {
      "id": "bosphorus",
      "name": "Bosphorus",
      "type": "chokepoint",
      "lat": 41.12,
      "lng": 29.05,
      "region": "black-sea",
      "commodities": [
        "grain",
        "crude"
      ],
      "aliases": [
        "bosphorus",
        "black sea"
      ]
    },
    {
      "id": "taiwan-strait",
      "name": "Taiwan Strait",
      "type": "chokepoint",
      "lat": 24.0,
      "lng": 119.5,
      "region": "e-asia",
      "commodities": [
        "container",
        "semiconductors"
      ],
      "aliases": [
        "taiwan",
        "taiwan strait",
        "formosa"
      ]
    },
    {
      "id": "port-jeddah",
      "name": "Jeddah Islamic Port",
      "type": "port",
      "lat": 21.48,
      "lng": 39.17,
      "region": "red-sea",
      "commodities": [
        "container",
        "crude"
      ]
    },
    {
      "id": "port-aden",
      "name": "Port of Aden",
      "type": "port",
      "lat": 12.78,
      "lng": 45.0,
      "region": "red-sea",
      "commodities": [
        "container",
        "crude"
      ]
    },
    {
      "id": "port-rotterdam",
      "name": "Port of Rotterdam",
      "type": "port",
      "lat": 51.95,
      "lng": 4.14,
      "region": "n-europe",
      "commodities": [
        "crude",
        "container",
        "lng",
        "grain"
      ],
      "aliases": [
        "rotterdam",
        "europe port"
      ]
    },
    {
      "id": "port-singapore",
      "name": "Port of Singapore",
      "type": "port",
      "lat": 1.26,
      "lng": 103.84,
      "region": "se-asia",
      "commodities": [
        "crude",
        "container",
        "lng"
      ]
    },
    {
      "id": "port-shanghai",
      "name": "Port of Shanghai",
      "type": "port",
      "lat": 31.23,
      "lng": 121.5,
      "region": "e-asia",
      "commodities": [
        "container",
        "semiconductors"
      ]
    },
    {
      "id": "port-los-angeles",
      "name": "Port of Los Angeles",
      "type": "port",
      "lat": 33.73,
      "lng": -118.26,
      "region": "americas",
      "commodities": [
        "container"
      ]
    },
    {
      "id": "port-houston",
      "name": "Port of Houston",
      "type": "port",
      "lat": 29.73,
      "lng": -95.27,
      "region": "americas",
      "commodities": [
        "crude",
        "lng"
      ],
      "aliases": [
        "houston",
        "us gulf",
        "gulf coast",
        "usgc"
      ]
    },
    {
      "id": "port-hamburg",
      "name": "Port of Hamburg",
      "type": "port",
      "lat": 53.54,
      "lng": 9.98,
      "region": "n-europe",
      "commodities": [
        "container",
        "grain"
      ]
    },
    {
      "id": "port-dubai",
      "name": "Jebel Ali",
      "type": "port",
      "lat": 25.01,
      "lng": 55.06,
      "region": "gulf",
      "commodities": [
        "container",
        "crude"
      ]
    },
    {
      "id": "port-mumbai",
      "name": "JNPT Mumbai",
      "type": "port",
      "lat": 18.95,
      "lng": 72.95,
      "region": "s-asia",
      "commodities": [
        "container",
        "crude"
      ]
    },
    {
      "id": "port-busan",
      "name": "Port of Busan",
      "type": "port",
      "lat": 35.1,
      "lng": 129.04,
      "region": "e-asia",
      "commodities": [
        "container",
        "semiconductors"
      ]
    },
    {
      "id": "port-santos",
      "name": "Port of Santos",
      "type": "port",
      "lat": -23.96,
      "lng": -46.31,
      "region": "americas",
      "commodities": [
        "grain",
        "container"
      ]
    },
    {
      "id": "port-odessa",
      "name": "Port of Odessa",
      "type": "port",
      "lat": 46.48,
      "lng": 30.73,
      "region": "black-sea",
      "commodities": [
        "grain"
      ]
    },
    {
      "id": "commodity-crude",
      "name": "Brent Crude",
      "type": "commodity",
      "lat": 55.0,
      "lng": 0.0,
      "region": "global",
      "commodities": [
        "crude"
      ]
    },
    {
      "id": "commodity-lng",
      "name": "LNG Spot",
      "type": "commodity",
      "lat": 51.5,
      "lng": 3.0,
      "region": "global",
      "commodities": [
        "lng"
      ]
    },
    {
      "id": "commodity-container",
      "name": "Container Freight",
      "type": "commodity",
      "lat": 1.3,
      "lng": 103.8,
      "region": "global",
      "commodities": [
        "container"
      ]
    },
    {
      "id": "commodity-grain",
      "name": "Wheat / Corn",
      "type": "commodity",
      "lat": 41.0,
      "lng": -95.0,
      "region": "global",
      "commodities": [
        "grain"
      ]
    },
    {
      "id": "commodity-semiconductors",
      "name": "Semiconductors",
      "type": "commodity",
      "lat": 24.8,
      "lng": 121.0,
      "region": "e-asia",
      "commodities": [
        "semiconductors"
      ]
    },
    {
      "id": "lane-asia-europe",
      "name": "Asia\u2013Europe Lane",
      "type": "lane",
      "lat": 15.0,
      "lng": 60.0,
      "region": "global",
      "commodities": [
        "container",
        "crude"
      ]
    },
    {
      "id": "lane-gulf-asia",
      "name": "Gulf\u2013Asia Energy",
      "type": "lane",
      "lat": 20.0,
      "lng": 70.0,
      "region": "global",
      "commodities": [
        "crude",
        "lng"
      ]
    },
    {
      "id": "lane-transpac",
      "name": "Transpacific",
      "type": "lane",
      "lat": 30.0,
      "lng": -160.0,
      "region": "americas",
      "commodities": [
        "container"
      ]
    },
    {
      "id": "lane-atlantic",
      "name": "Transatlantic",
      "type": "lane",
      "lat": 40.0,
      "lng": -40.0,
      "region": "global",
      "commodities": [
        "container",
        "lng"
      ]
    },
    {
      "id": "lane-black-sea",
      "name": "Black Sea Grain",
      "type": "lane",
      "lat": 42.0,
      "lng": 32.0,
      "region": "black-sea",
      "commodities": [
        "grain"
      ]
    },
    {
      "id": "hub-fujairah",
      "name": "Fujairah Bunker Hub",
      "type": "hub",
      "lat": 25.12,
      "lng": 56.35,
      "region": "gulf",
      "commodities": [
        "crude"
      ]
    },
    {
      "id": "hub-ara",
      "name": "ARA Hub",
      "type": "hub",
      "lat": 51.9,
      "lng": 4.3,
      "region": "n-europe",
      "commodities": [
        "crude",
        "lng"
      ],
      "aliases": [
        "europe",
        "ara",
        "eu gas",
        "rotterdam hub",
        "russian gas"
      ]
    },
    {
      "id": "hub-houston",
      "name": "USGC Hub",
      "type": "hub",
      "lat": 29.7,
      "lng": -95.0,
      "region": "americas",
      "commodities": [
        "crude",
        "lng"
      ]
    },
    {
      "id": "refinery-singapore",
      "name": "Jurong Refining",
      "type": "refinery",
      "lat": 1.29,
      "lng": 103.7,
      "region": "se-asia",
      "commodities": [
        "crude"
      ]
    },
    {
      "id": "refinery-rotterdam",
      "name": "Pernis Refinery",
      "type": "refinery",
      "lat": 51.88,
      "lng": 4.38,
      "region": "n-europe",
      "commodities": [
        "crude"
      ]
    },
    {
      "id": "yard-busan",
      "name": "Busan Yard",
      "type": "yard",
      "lat": 35.08,
      "lng": 129.0,
      "region": "e-asia",
      "commodities": [
        "container"
      ]
    },
    {
      "id": "farm-ukraine",
      "name": "Ukrainian Grain Belt",
      "type": "origin",
      "lat": 48.5,
      "lng": 32.0,
      "region": "black-sea",
      "commodities": [
        "grain"
      ]
    },
    {
      "id": "fab-taiwan",
      "name": "TSMC Cluster",
      "type": "origin",
      "lat": 24.78,
      "lng": 120.99,
      "region": "e-asia",
      "commodities": [
        "semiconductors"
      ]
    },
    {